{
  "state_version": "sentinel-state/1.0",
  "line_id": "__ALL__",
  "updated_at": "2026-10-06T01:00:51.458378+00:00",
  "baseline_ref": "D:\\codes\\industrial-deep-diagnostic\\workspace\\closedloop\\sentinel\\baselines\\line1-extruder-206hold-20261006\\watch_baseline.json",
  "last_seen_ts": null,
  "last_index": 399,
  "ring_buffer": {
    "cols": [
      "演示·挤出主机PLC(Modbus TCP)·熔体温度(dn-0183240d)",
      "演示·晶点计数从站(Modbus RTU)·晶点计数(dn-a41c49cc)"
    ],
    "rows": [
      [
        205.3,
        4.0
      ],
      [
        205.8,
        4.0
      ],
      [
        205.6,
        4.0
      ],
      [
        206.1,
        2.0
      ],
      [
        205.7,
        6.0
      ],
      [
        206.0,
        4.0
      ],
      [
        205.6,
        3.0
      ],
      [
        205.8,
        6.0
      ],
      [
        206.0,
        2.0
      ],
      [
        205.4,
        3.0
      ],
      [
        206.3,
        5.0
      ],
      [
        206.8,
        4.0
      ],
      [
        206.1,
        2.0
      ],
      [
        206.9,
        4.0
      ],
      [
        206.2,
        1.0
      ],
      [
        205.6,
        1.0
      ],
      [
        206.3,
        6.0
      ],
      [
        206.5,
        5.0
      ],
      [
        206.3,
        7.0
      ],
      [
        206.2,
        4.0
      ],
      [
        206.6,
        5.0
      ],
      [
        206.5,
        4.0
      ],
      [
        206.1,
        6.0
      ],
      [
        206.1,
        3.0
      ],
      [
        206.0,
        4.0
      ],
      [
        206.2,
        5.0
      ],
      [
        205.9,
        3.0
      ],
      [
        206.2,
        5.0
      ],
      [
        205.9,
        4.0
      ],
      [
        206.2,
        7.0
      ],
      [
        206.3,
        7.0
      ],
      [
        205.2,
        4.0
      ],
      [
        205.6,
        5.0
      ],
      [
        206.1,
        5.0
      ],
      [
        206.2,
        5.0
      ],
      [
        206.1,
        7.0
      ],
      [
        205.9,
        3.0
      ],
      [
        206.1,
        4.0
      ],
      [
        206.2,
        3.0
      ],
      [
        205.3,
        7.0
      ],
      [
        206.2,
        4.0
      ],
      [
        206.1,
        4.0
      ],
      [
        205.6,
        5.0
      ],
      [
        205.6,
        5.0
      ],
      [
        206.1,
        1.0
      ],
      [
        206.0,
        1.0
      ],
      [
        205.9,
        3.0
      ],
      [
        207.1,
        6.0
      ],
      [
        205.7,
        4.0
      ],
      [
        205.5,
        8.0
      ],
      [
        206.1,
        3.0
      ],
      [
        204.9,
        5.0
      ],
      [
        206.3,
        4.0
      ],
      [
        206.4,
        5.0
      ],
      [
        205.4,
        3.0
      ],
      [
        206.3,
        5.0
      ],
      [
        206.2,
        4.0
      ],
      [
        206.2,
        4.0
      ],
      [
        206.5,
        3.0
      ],
      [
        205.8,
        5.0
      ],
      [
        206.9,
        3.0
      ],
      [
        205.6,
        3.0
      ],
      [
        206.8,
        4.0
      ],
      [
        206.5,
        5.0
      ],
      [
        205.8,
        6.0
      ],
      [
        206.1,
        4.0
      ],
      [
        206.0,
        4.0
      ],
      [
        206.4,
        2.0
      ],
      [
        206.3,
        2.0
      ],
      [
        206.3,
        4.0
      ],
      [
        206.0,
        5.0
      ],
      [
        205.8,
        3.0
      ],
      [
        206.1,
        4.0
      ],
      [
        205.6,
        6.0
      ],
      [
        206.3,
        2.0
      ],
      [
        206.3,
        7.0
      ],
      [
        205.8,
        7.0
      ],
      [
        205.6,
        4.0
      ],
      [
        206.1,
        3.0
      ],
      [
        205.0,
        4.0
      ],
      [
        205.8,
        2.0
      ],
      [
        206.7,
        3.0
      ],
      [
        205.8,
        1.0
      ],
      [
        205.8,
        3.0
      ],
      [
        205.9,
        2.0
      ],
      [
        206.0,
        4.0
      ],
      [
        205.9,
        3.0
      ],
      [
        206.0,
        1.0
      ],
      [
        205.8,
        3.0
      ],
      [
        205.6,
        3.0
      ],
      [
        206.1,
        4.0
      ],
      [
        206.2,
        4.0
      ],
      [
        205.6,
        6.0
      ],
      [
        206.1,
        1.0
      ],
      [
        206.1,
        5.0
      ],
      [
        206.0,
        4.0
      ],
      [
        205.9,
        3.0
      ],
      [
        206.2,
        4.0
      ],
      [
        206.0,
        3.0
      ],
      [
        206.0,
        3.0
      ],
      [
        206.1,
        5.0
      ],
      [
        204.9,
        4.0
      ],
      [
        205.9,
        4.0
      ],
      [
        205.4,
        2.0
      ],
      [
        206.1,
        4.0
      ],
      [
        206.2,
        4.0
      ],
      [
        206.0,
        5.0
      ],
      [
        205.5,
        2.0
      ],
      [
        205.8,
        3.0
      ],
      [
        205.9,
        1.0
      ],
      [
        205.9,
        4.0
      ],
      [
        207.0,
        4.0
      ],
      [
        205.9,
        2.0
      ],
      [
        205.7,
        4.0
      ],
      [
        206.2,
        5.0
      ],
      [
        206.7,
        1.0
      ],
      [
        206.1,
        3.0
      ],
      [
        204.9,
        2.0
      ],
      [
        206.1,
        2.0
      ],
      [
        206.4,
        6.0
      ],
      [
        206.3,
        6.0
      ],
      [
        206.7,
        4.0
      ],
      [
        206.0,
        5.0
      ],
      [
        206.0,
        5.0
      ],
      [
        206.0,
        4.0
      ],
      [
        206.3,
        2.0
      ],
      [
        206.0,
        4.0
      ],
      [
        206.2,
        1.0
      ],
      [
        206.5,
        5.0
      ],
      [
        205.5,
        2.0
      ],
      [
        206.2,
        4.0
      ],
      [
        205.3,
        3.0
      ],
      [
        205.6,
        3.0
      ],
      [
        205.7,
        6.0
      ],
      [
        206.7,
        5.0
      ],
      [
        205.6,
        5.0
      ],
      [
        205.6,
        2.0
      ],
      [
        205.7,
        2.0
      ],
      [
        206.4,
        4.0
      ],
      [
        206.2,
        6.0
      ],
      [
        205.2,
        4.0
      ],
      [
        206.3,
        5.0
      ],
      [
        206.0,
        4.0
      ],
      [
        205.9,
        7.0
      ],
      [
        206.2,
        5.0
      ],
      [
        205.5,
        5.0
      ],
      [
        205.6,
        7.0
      ],
      [
        206.4,
        5.0
      ],
      [
        206.5,
        1.0
      ],
      [
        206.3,
        4.0
      ],
      [
        206.0,
        5.0
      ],
      [
        205.7,
        5.0
      ],
      [
        205.6,
        4.0
      ],
      [
        206.2,
        3.0
      ],
      [
        205.6,
        4.0
      ],
      [
        206.2,
        1.0
      ],
      [
        206.8,
        4.0
      ],
      [
        206.0,
        3.0
      ],
      [
        206.0,
        3.0
      ],
      [
        205.8,
        5.0
      ],
      [
        205.9,
        6.0
      ],
      [
        206.3,
        3.0
      ],
      [
        205.8,
        4.0
      ],
      [
        205.6,
        4.0
      ],
      [
        205.3,
        3.0
      ],
      [
        205.6,
        4.0
      ],
      [
        206.0,
        4.0
      ],
      [
        205.5,
        3.0
      ],
      [
        206.1,
        3.0
      ],
      [
        205.6,
        4.0
      ],
      [
        206.7,
        3.0
      ],
      [
        205.5,
        5.0
      ],
      [
        205.7,
        5.0
      ],
      [
        206.2,
        4.0
      ],
      [
        207.0,
        4.0
      ],
      [
        206.3,
        1.0
      ],
      [
        206.0,
        5.0
      ],
      [
        206.3,
        3.0
      ],
      [
        205.6,
        3.0
      ],
      [
        206.2,
        4.0
      ],
      [
        205.6,
        5.0
      ],
      [
        206.3,
        6.0
      ],
      [
        206.4,
        1.0
      ],
      [
        205.8,
        4.0
      ],
      [
        205.6,
        5.0
      ],
      [
        206.3,
        5.0
      ],
      [
        205.8,
        5.0
      ],
      [
        206.3,
        5.0
      ],
      [
        206.1,
        4.0
      ],
      [
        205.8,
        6.0
      ],
      [
        205.9,
        6.0
      ],
      [
        207.0,
        4.0
      ],
      [
        206.3,
        6.0
      ],
      [
        206.6,
        6.0
      ],
      [
        206.3,
        4.0
      ],
      [
        205.9,
        3.0
      ],
      [
        206.2,
        4.0
      ],
      [
        205.6,
        6.0
      ],
      [
        205.8,
        2.0
      ],
      [
        206.0,
        2.0
      ],
      [
        206.1,
        2.0
      ],
      [
        205.9,
        4.0
      ],
      [
        205.9,
        5.0
      ],
      [
        205.8,
        4.0
      ],
      [
        205.4,
        3.0
      ],
      [
        206.3,
        3.0
      ],
      [
        206.5,
        5.0
      ],
      [
        206.1,
        2.0
      ],
      [
        206.2,
        4.0
      ],
      [
        206.2,
        2.0
      ],
      [
        206.5,
        4.0
      ],
      [
        205.1,
        6.0
      ],
      [
        206.4,
        3.0
      ],
      [
        206.1,
        3.0
      ],
      [
        205.7,
        6.0
      ],
      [
        206.1,
        5.0
      ],
      [
        205.9,